sep=,
"Explainable Abusive Language Classification Leveraging User and Network Data","Machine Learning and Knowledge Discovery in Databases. Applied Data Science Track","","","","10.1007/978-3-030-86517-7_30","Maximilian WichEdoardo MoscaAdrian GorniakJohannes HingerlGeorg Groh","2021","http://link.springer.com/chapter/10.1007/978-3-030-86517-7_30","Chapter"
"BERT and Prerequisite Based Ontology for Predicting Learner’s Confusion in MOOCs Discussion Forums","Artificial Intelligence in Education","","","","10.1007/978-3-030-52240-7_10","Abdessamad ChanaaNour-Eddine El Faddouli","2020","http://link.springer.com/chapter/10.1007/978-3-030-52240-7_10","Chapter"
"Detection of Malicious PowerShell Using Word-Level Language Models","Advances in Information and Computer Security","","","","10.1007/978-3-030-58208-1_3","Yui TajiriMamoru Mimura","2020","http://link.springer.com/chapter/10.1007/978-3-030-58208-1_3","Chapter"
"Anomaly Detection in Cellular IoT with Machine Learning","Smart Objects and Technologies for Social Good","","","","10.1007/978-3-030-91421-9_5","Bernardo SantosImran Qayyrm KhanBruno DzogovicBoning FengVan Thuan DoNiels JacotThanh Van Do","2021","http://link.springer.com/chapter/10.1007/978-3-030-91421-9_5","Chapter"
"Automated Grading of Exam Responses: An Extensive Classification Benchmark","Discovery Science","","","","10.1007/978-3-030-88942-5_1","Jimmy LjungmanVanessa LislevandJohn PavlopoulosAlexandra FarazouliZed LeePanagiotis PapapetrouUno Fors","2021","http://link.springer.com/chapter/10.1007/978-3-030-88942-5_1","Chapter"
"AMQAN: Adaptive Multi-Attention Question-Answer Networks for Answer Selection","Machine Learning and Knowledge Discovery in Databases","","","","10.1007/978-3-030-67664-3_35","Haitian YangWeiqing HuangXuan ZhaoYan WangYuyan ChenBin LvRui MaoNing Li","2021","http://link.springer.com/chapter/10.1007/978-3-030-67664-3_35","Chapter"
"Prediction of Social Ties Based on Bluetooth Proximity Time Series Data","Advances in Computational Intelligence","","","","10.1007/978-3-030-60887-3_37","José C. Carrasco-JiménezRamon F. BrenaSigfrido Iglesias","2020","http://link.springer.com/chapter/10.1007/978-3-030-60887-3_37","Chapter"
"Human-Centered Artificial Intelligence: Antecedents of Trust for the Usage of Voice Biometrics for Driving Contactless Interactions","HCI International 2020 – Late Breaking Posters","","","","10.1007/978-3-030-60700-5_42","Rohan KathuriaAnanay WadehraVinish Kathuria","2020","http://link.springer.com/chapter/10.1007/978-3-030-60700-5_42","Chapter"
"Graph Convolutional Networks for Student Answers Assessment","Text, Speech, and Dialogue","","","","10.1007/978-3-030-58323-1_57","Nisrine Ait KhayiVasile Rus","2020","http://link.springer.com/chapter/10.1007/978-3-030-58323-1_57","Chapter"
"Fuzzy Group Decision-Making Methods","Advances in Fuzzy Group Decision Making","","","","10.1007/978-3-030-86208-4_2","Tin-Chih Toly Chen","2021","http://link.springer.com/chapter/10.1007/978-3-030-86208-4_2","Chapter"
"AI and BD in Process Industry: A Literature Review with an Operational Perspective","Advances in Production Management Systems. Artificial Intelligence for Sustainable and Resilient Production Systems","","","","10.1007/978-3-030-85914-5_61","Rosanna FornasieroDavid F. NettletonLorenz KieblerAlicia Martinez de YusoChiara Eleonora De Marco","2021","http://link.springer.com/chapter/10.1007/978-3-030-85914-5_61","Chapter"
"Author Contributed Representation for Scholarly Network","Web and Big Data","","","","10.1007/978-3-030-60259-8_41","Binglei WangTong XuHao WangYanmin ChenLe ZhangLintao FangGuiquan LiuEnhong Chen","2020","http://link.springer.com/chapter/10.1007/978-3-030-60259-8_41","Chapter"
"FHA: Fast Heuristic Attack Against Graph Convolutional Networks","Discovery Science","","","","10.1007/978-3-030-88942-5_12","Haoxi ZhanXiaobing Pei","2021","http://link.springer.com/chapter/10.1007/978-3-030-88942-5_12","Chapter"
"Emotion Recognition of Speech in Hindi Using Dimensionality Reduction and Machine Learning Techniques","Information and Communication Technology and Applications","","","","10.1007/978-3-030-69143-1_10","Akshat AgrawalAnurag Jain","2021","http://link.springer.com/chapter/10.1007/978-3-030-69143-1_10","Chapter"
"Coarse and Fine-Grained Hostility Detection in Hindi Posts Using Fine Tuned Multilingual Embeddings","Combating Online Hostile Posts in Regional Languages during Emergency Situation","","","","10.1007/978-3-030-73696-5_19","Arkadipta DeVenkatesh ElangovanKaushal Kumar MauryaMaunendra Sankar Desarkar","2021","http://link.springer.com/chapter/10.1007/978-3-030-73696-5_19","Chapter"
"Parameter Identification of RANS Turbulence Model Using Physics-Embedded Neural Network","High Performance Computing","","","","10.1007/978-3-030-59851-8_9","Shirui LuoMadhu VellakalSeid KoricVolodymyr KindratenkoJiahuan Cui","2020","http://link.springer.com/chapter/10.1007/978-3-030-59851-8_9","Chapter"
"Evaluation of a Failure Prediction Model for Large Scale Cloud Applications","Advances in Artificial Intelligence","","","","10.1007/978-3-030-47358-7_32","Mohammad S. JassasQusay H. Mahmoud","2020","http://link.springer.com/chapter/10.1007/978-3-030-47358-7_32","Chapter"
"PVFNet: Point-View Fusion Network for 3D Shape Recognition","Knowledge Science, Engineering and Management","","","","10.1007/978-3-030-55130-8_26","Jun YangJisheng Dang","2020","http://link.springer.com/chapter/10.1007/978-3-030-55130-8_26","Chapter"
"LiMNet: Early-Stage Detection of IoT Botnets with Lightweight Memory Networks","Computer Security – ESORICS 2021","","","","10.1007/978-3-030-88418-5_29","Lodovico GiarettaAhmed LekssaysBarbara CarminatiElena FerrariŠarūnas Girdzijauskas","2021","http://link.springer.com/chapter/10.1007/978-3-030-88418-5_29","Chapter"
"Intelligent Power Controller of Wireless Body Area Networks Based on Deep Reinforcement Learning","Bio-inspired Information and Communication Technologies","","","","10.1007/978-3-030-57115-3_21","Peng HeZhenli LiuLei FuZhongyuan TaoJia LiuTong TangZhidu Li","2020","http://link.springer.com/chapter/10.1007/978-3-030-57115-3_21","Chapter"
"Automatic Management of Cloud Applications with Use of Proximal Policy Optimization","Computational Science – ICCS 2020","","","","10.1007/978-3-030-50371-0_6","Włodzimierz FunikaPaweł KoperekJacek Kitowski","2020","http://link.springer.com/chapter/10.1007/978-3-030-50371-0_6","Chapter"
"A Multi-task Approach to Open Domain Suggestion Mining Using Language Model for Text Over-Sampling","Advances in Information Retrieval","","","","10.1007/978-3-030-45442-5_28","Maitree LeekhaMononito GoswamiMinni Jain","2020","http://link.springer.com/chapter/10.1007/978-3-030-45442-5_28","Chapter"
"Time-Critical Geolocation for Social Good","Advances in Information Retrieval","","","","10.1007/978-3-030-45442-5_82","Reem Suwaileh","2020","http://link.springer.com/chapter/10.1007/978-3-030-45442-5_82","Chapter"
"Convolutional Neural Network-Based DOA Estimation Using Non-uniform Linear Array for Multipath Channels","Industrial Networks and Intelligent Systems","","","","10.1007/978-3-030-63083-6_4","Van-Sang DoanThien Huynh-TheVan-Phuc HoangDong-Seong Kim","2020","http://link.springer.com/chapter/10.1007/978-3-030-63083-6_4","Chapter"
"Interpretability of Black Box Models Through Data-View Extraction and Shadow Model Creation","Neural Information Processing","","","","10.1007/978-3-030-63823-8_44","Rupam PatirShubham SinghalC. AnantaramVikram Goyal","2020","http://link.springer.com/chapter/10.1007/978-3-030-63823-8_44","Chapter"
"An Attempt to Evaluate Information Spread Using the Hawkes Process","Proceedings of the Future Technologies Conference (FTC) 2021, Volume 2","","","","10.1007/978-3-030-89880-9_27","Pierre WatineArezo BodaghiKetra A. Schmitt","2022","http://link.springer.com/chapter/10.1007/978-3-030-89880-9_27","Chapter"
"A Novel Prevention Technique Using Deep Analysis Intruder Tracing with a Bottom-Up Approach Against Flood Attacks in VoIP Systems","Intelligent Computing & Optimization","","","","10.1007/978-3-030-93247-3_85","Sheeba ArmoogumNawaz Mohamudally","2022","http://link.springer.com/chapter/10.1007/978-3-030-93247-3_85","Chapter"
"An Intelligent Predictive Maintenance Approach Based on End-of-Line Test Logfiles in the Automotive Industry","Industrial IoT Technologies and Applications","","","","10.1007/978-3-030-71061-3_8","David VicêncioHugo SilvaSalviano SoaresVítor FilipeAntónio Valente","2021","http://link.springer.com/chapter/10.1007/978-3-030-71061-3_8","Chapter"
"Measuring Memorization Effect in Word-Level Neural Networks Probing","Text, Speech, and Dialogue","","","","10.1007/978-3-030-58323-1_19","Rudolf RosaTomáš MusilDavid Mareček","2020","http://link.springer.com/chapter/10.1007/978-3-030-58323-1_19","Chapter"
"Individual Movement Monitor Using Data Mining","Data Intelligence and Cognitive Informatics","","","","10.1007/978-981-16-6460-1_24","Deshak BhatnagarSiddhaling Urolagin","2022","http://link.springer.com/chapter/10.1007/978-981-16-6460-1_24","Chapter"
"Towards Network Anomaly Detection Using Graph Embedding","Computational Science – ICCS 2020","","","","10.1007/978-3-030-50423-6_12","Qingsai XiaoJian LiuQuiyun WangZhengwei JiangXuren WangYepeng Yao","2020","http://link.springer.com/chapter/10.1007/978-3-030-50423-6_12","Chapter"
"Suggesting Descriptive Method Names: An Exploratory Study of Two Machine Learning Approaches","Quality of Information and Communications Technology","","","","10.1007/978-3-030-58793-2_8","Oleksandr ZaitsevStephane DucasseAlexandre BergelMathieu Eveillard","2020","http://link.springer.com/chapter/10.1007/978-3-030-58793-2_8","Chapter"
"Ensemble Feature Selection Approach for Detecting Denial of Service Attacks in RPL Networks","Advances in Cyber Security","","","","10.1007/978-981-16-8059-5_21","Taief Alaa AlamiedyMohammed F. R. AnbarBahari BelatonArkan Hamoodi KablaBaidaa Hamza Khudayer","2021","http://link.springer.com/chapter/10.1007/978-981-16-8059-5_21","Chapter"
"A Method for Decompensation Prediction in Emergency and Harsh Situations","Web and Big Data","","","","10.1007/978-3-030-60290-1_6","Guozheng RaoShuying ZhaoLi ZhangQing CongZhiyong Feng","2020","http://link.springer.com/chapter/10.1007/978-3-030-60290-1_6","Chapter"
"A General Machine Learning Framework for Survival Analysis","Machine Learning and Knowledge Discovery in Databases","","","","10.1007/978-3-030-67664-3_10","Andreas BenderDavid RügamerFabian ScheiplBernd Bischl","2021","http://link.springer.com/chapter/10.1007/978-3-030-67664-3_10","Chapter"
"RFM-Based Customer Analysis and Product Recommendation System","Advanced Computing and Intelligent Technologies","","","","10.1007/978-981-16-2164-2_13","Rahul KrishnanPrashant R. Nair","2022","http://link.springer.com/chapter/10.1007/978-981-16-2164-2_13","Chapter"
"Deep Attention Model with Multiple Features for Rumor Identification","Frontiers in Cyber Security","","","","10.1007/978-981-15-9739-8_6","Lina WangWenqi WangTong ChenJianpeng KeBenxiao Tang","2020","http://link.springer.com/chapter/10.1007/978-981-15-9739-8_6","Chapter"
"Trainable Windowing Coefficients in DNN for Raw Audio Classification","Cloud Computing, Big Data & Emerging Topics","","","","10.1007/978-3-030-61218-4_11","Mario Alejandro GarcíaEduardo Atilio DestéfanisAna Lorena Rosset","2020","http://link.springer.com/chapter/10.1007/978-3-030-61218-4_11","Chapter"
"Research on the Application of Personalized Course Recommendation of Learn to Rank Based on Knowledge Graph","Mobile Wireless Middleware, Operating Systems and Applications","","","","10.1007/978-3-030-62205-3_2","Hao WuFanJun Meng","2020","http://link.springer.com/chapter/10.1007/978-3-030-62205-3_2","Chapter"
"On the Performance of Planning Through Backpropagation","Intelligent Systems","","","","10.1007/978-3-030-61380-8_8","Renato ScaroniThiago P. BuenoLeliane N. de BarrosDenis Mauá","2020","http://link.springer.com/chapter/10.1007/978-3-030-61380-8_8","Chapter"
"Hybrid Text Feature Modeling for Disease Group Prediction Using Unstructured Physician Notes","Computational Science – ICCS 2020","","","","10.1007/978-3-030-50423-6_24","Gokul S. KrishnanS. Sowmya Kamath","2020","http://link.springer.com/chapter/10.1007/978-3-030-50423-6_24","Chapter"
"Investigating the Impact of Pre-trained Word Embeddings on Memorization in Neural Networks","Text, Speech, and Dialogue","","","","10.1007/978-3-030-58323-1_30","Aleena ThomasDavid Ifeoluwa AdelaniAli DavodyAditya MogadalaDietrich Klakow","2020","http://link.springer.com/chapter/10.1007/978-3-030-58323-1_30","Chapter"
"Exploring Sequence-to-Sequence Models for SPARQL Pattern Composition","Knowledge Graphs and Semantic Web","","","","10.1007/978-3-030-65384-2_12","Anand PanchbhaiTommaso SoruEdgard Marx","2020","http://link.springer.com/chapter/10.1007/978-3-030-65384-2_12","Chapter"
"Reject and Cascade Classifier with Subgroup Discovery for Interpretable Metagenomic Signatures","Machine Learning and Principles and Practice of Knowledge Discovery in Databases","","","","10.1007/978-3-030-93736-2_5","Maxence QueyrelAlexandre TemplierJean-Daniel Zucker","2021","http://link.springer.com/chapter/10.1007/978-3-030-93736-2_5","Chapter"
"DyHGCN: A Dynamic Heterogeneous Graph Convolutional Network to Learn Users’ Dynamic Preferences for Information Diffusion Prediction","Machine Learning and Knowledge Discovery in Databases","","","","10.1007/978-3-030-67664-3_21","Chunyuan YuanJiacheng LiWei ZhouYijun LuXiaodan ZhangSonglin Hu","2021","http://link.springer.com/chapter/10.1007/978-3-030-67664-3_21","Chapter"
"Detecting Advanced Persistent Threat in Edge Computing via Federated Learning","Security and Privacy in Digital Economy","","","","10.1007/978-981-15-9129-7_36","Zitong LiJiale ChenJiale ZhangXiang ChengBing Chen","2020","http://link.springer.com/chapter/10.1007/978-981-15-9129-7_36","Chapter"
"Smart Freight Transportation Platform Development and Impacts on CO2 Emission in Quebec","Proceedings of the Future Technologies Conference (FTC) 2021, Volume 2","","","","10.1007/978-3-030-89880-9_42","Marjan PadidarSamira KeivanpourMaha BenAli","2022","http://link.springer.com/chapter/10.1007/978-3-030-89880-9_42","Chapter"
"Modeling Dynamic Social Behaviors with Time-Evolving Graphs for User Behavior Predictions","Database Systems for Advanced Applications","","","","10.1007/978-3-030-73194-6_35","Tianzi ZangYanmin ZhuChen GongHaobing LiuBo Li","2021","http://link.springer.com/chapter/10.1007/978-3-030-73194-6_35","Chapter"
"Classification of Rare Recipes Requires Linguistic Features as Special Ingredients","Advances in Artificial Intelligence","","","","10.1007/978-3-030-47358-7_44","Elham MohammadiNada NajiLouis MarceauMarc QueudotEric ChartonLeila KosseimMarie-Jean Meurs","2020","http://link.springer.com/chapter/10.1007/978-3-030-47358-7_44","Chapter"
"Demand Manipulation Attack Resilient Privacy Aware Smart Grid Using PUFs and Blockchain","Applied Cryptography and Network Security Workshops","","","","10.1007/978-3-030-81645-2_15","Soumyadyuti GhoshUrbi ChatterjeeDurba ChatterjeeRumia MasburahDebdeep MukhopadhyaySoumyajit Dey","2021","http://link.springer.com/chapter/10.1007/978-3-030-81645-2_15","Chapter"
"Scalable Data-Intensive Geocomputation: A Design for Real-Time Continental Flood Inundation Mapping","Driving Scientific and Engineering Discoveries Through the Convergence of HPC, Big Data and AI","","","","10.1007/978-3-030-63393-6_9","Yan Y. LiuJibonananda Sanyal","2020","http://link.springer.com/chapter/10.1007/978-3-030-63393-6_9","Chapter"
"Predicting Learners Need for Recommendation Using Dynamic Graph-Based Knowledge Tracing","Artificial Intelligence in Education","","","","10.1007/978-3-030-52240-7_9","Abdessamad ChanaaNour-Eddine El Faddouli","2020","http://link.springer.com/chapter/10.1007/978-3-030-52240-7_9","Chapter"
"Exercise Hierarchical Feature Enhanced Knowledge Tracing","Artificial Intelligence in Education","","","","10.1007/978-3-030-52240-7_59","Hanshuang TongYun ZhouZhen Wang","2020","http://link.springer.com/chapter/10.1007/978-3-030-52240-7_59","Chapter"
"Investigating Transformers for Automatic Short Answer Grading","Artificial Intelligence in Education","","","","10.1007/978-3-030-52240-7_8","Leon CamusAnna Filighera","2020","http://link.springer.com/chapter/10.1007/978-3-030-52240-7_8","Chapter"
"Tell Me How You Re-Charge, I Will Tell You Where You Drove To: Electric Vehicles Profiling Based on Charging-Current Demand","Computer Security – ESORICS 2021","","","","10.1007/978-3-030-88418-5_31","Alessandro BrighenteMauro ContiIzza Sadaf","2021","http://link.springer.com/chapter/10.1007/978-3-030-88418-5_31","Chapter"
"Conditional Neural Relational Inference for Interacting Systems","Machine Learning and Knowledge Discovery in Databases. Applied Data Science Track","","","","10.1007/978-3-030-86517-7_12","Joao A. Candido RamosLionel BlondéStéphane ArmandAlexandros Kalousis","2021","http://link.springer.com/chapter/10.1007/978-3-030-86517-7_12","Chapter"
"Deep Knowledge Tracing with Transformers","Artificial Intelligence in Education","","","","10.1007/978-3-030-52240-7_46","Shi PuMichael YudelsonLu OuYuchi Huang","2020","http://link.springer.com/chapter/10.1007/978-3-030-52240-7_46","Chapter"
"Principle-to-Program: Neural Methods for Similar Question Retrieval in Online Communities","Advances in Information Retrieval","","","","10.1007/978-3-030-45442-5_88","Muthusamy ChelliahManish ShrivastavaJaidam Ram Tej","2020","http://link.springer.com/chapter/10.1007/978-3-030-45442-5_88","Chapter"
"Maximizing Explainability with SF-Lasso and Selective Inference for Video and Picture Ads","Advances in Knowledge Discovery and Data Mining","","","","10.1007/978-3-030-75762-5_45","Eunkyung ParkRaymond K. WongJunbum KwonVictor W. Chu","2021","http://link.springer.com/chapter/10.1007/978-3-030-75762-5_45","Chapter"
"Activity recognition in a smart home using local feature weighting and variants of nearest-neighbors classifiers","Journal of Ambient Intelligence and Humanized Computing","","12","2","10.1007/s12652-020-02348-6","Labiba Gillani FahadSyed Fahad Tahir","2021","http://link.springer.com/article/10.1007/s12652-020-02348-6","Article"
"Unsupervised Anomaly Detection in Daily WAN Traffic Patterns","Driving Scientific and Engineering Discoveries Through the Convergence of HPC, Big Data and AI","","","","10.1007/978-3-030-63393-6_16","Scott CampbellMariam KiranFatema Bannat Wala","2020","http://link.springer.com/chapter/10.1007/978-3-030-63393-6_16","Chapter"
"Learning Ability Community for Personalized Knowledge Tracing","Web and Big Data","","","","10.1007/978-3-030-60290-1_14","Juntao ZhangBiao LiWei SongNanzhou LinXiandi YangZhiyong Peng","2020","http://link.springer.com/chapter/10.1007/978-3-030-60290-1_14","Chapter"
"Influence of Random Walk Parametrization on Graph Embeddings","Advances in Information Retrieval","","","","10.1007/978-3-030-45442-5_8","Fabian SchliskiJörg SchlöttererMichael Granitzer","2020","http://link.springer.com/chapter/10.1007/978-3-030-45442-5_8","Chapter"
"Visual Analytics for Extracting Trends from Spatio-temporal Data","Advanced Analytics and Learning on Temporal Data","","","","10.1007/978-3-030-65742-0_9","Michiel DhontElena TsiporkovaTom TourwéNicolás González-Deleito","2020","http://link.springer.com/chapter/10.1007/978-3-030-65742-0_9","Chapter"
"Text Summarization of Articles Using LSTM and Attention-Based LSTM","Machine Learning and Autonomous Systems","","","","10.1007/978-981-16-7996-4_10","Harsh KumarGaurav KumarShaivye SinghSourav Paul","2022","http://link.springer.com/chapter/10.1007/978-981-16-7996-4_10","Chapter"
"Improving Deep Item-Based Collaborative Filtering with Bayesian Personalized Ranking for MOOC Course Recommendation","Knowledge Science, Engineering and Management","","","","10.1007/978-3-030-55130-8_22","Xiao LiXiang LiJintao TangTing WangYang ZhangHongyi Chen","2020","http://link.springer.com/chapter/10.1007/978-3-030-55130-8_22","Chapter"
"Capturing Fairness and Uncertainty in Student Dropout Prediction – A Comparison Study","Artificial Intelligence in Education","","","","10.1007/978-3-030-78270-2_25","Efthyvoulos DrousiotisPanagiotis PentaliotisLei ShiAlexandra I. Cristea","2021","http://link.springer.com/chapter/10.1007/978-3-030-78270-2_25","Chapter"
"Adaptive Ensemble Variants of Random Vector Functional Link Networks","Neural Information Processing","","","","10.1007/978-3-030-63823-8_4","Minghui HuQiushi ShiP. N. SuganthanM. Tanveer","2020","http://link.springer.com/chapter/10.1007/978-3-030-63823-8_4","Chapter"
"Deep-Cross-Attention Recommendation Model for Knowledge Sharing Micro Learning Service","Artificial Intelligence in Education","","","","10.1007/978-3-030-52240-7_31","Jiayin LinGeng SunJun ShenDavid PritchardTingru CuiDongming XuLi LiGhassan BeydounShiping Chen","2020","http://link.springer.com/chapter/10.1007/978-3-030-52240-7_31","Chapter"
"Distributed AI for Special-Purpose Vehicles","Computer Safety, Reliability, and Security. SAFECOMP 2020 Workshops","","","","10.1007/978-3-030-55583-2_18","Kevin Van VaerenberghHenrique CabralPierre DagnelyTom Tourwé","2020","http://link.springer.com/chapter/10.1007/978-3-030-55583-2_18","Chapter"
"Information Source Estimation with Multi-Channel Graph Neural Network","Graph Data Mining","","","","10.1007/978-981-16-2609-8_1","Xincheng ShuBin YuZhongyuan RuanQingpeng ZhangQi Xuan","2021","http://link.springer.com/chapter/10.1007/978-981-16-2609-8_1","Chapter"
"Ranking Pathology Data in the Absence of a Ground Truth","Artificial Intelligence XXXVIII","","","","10.1007/978-3-030-91100-3_18","Jing QiGirvan BurnsideFrans Coenen","2021","http://link.springer.com/chapter/10.1007/978-3-030-91100-3_18","Chapter"
"DDNE: Discriminative Distance Metric Learning for Network Embedding","Computational Science – ICCS 2020","","","","10.1007/978-3-030-50371-0_42","Xiaoxue LiYangxi LiYanmin ShangLingling TongFang FangPengfei YinJie ChengJing Li","2020","http://link.springer.com/chapter/10.1007/978-3-030-50371-0_42","Chapter"
"Reduced Order Modeling of Dynamical Systems Using Artificial Neural Networks Applied to Water Circulation","High Performance Computing","","","","10.1007/978-3-030-59851-8_8","Alberto Costa Nogueira Jr.João Lucas de Sousa AlmeidaGuillaume AugerCampbell D. Watson","2020","http://link.springer.com/chapter/10.1007/978-3-030-59851-8_8","Chapter"
"Intention Multiple-Representation Model for Logistics Intelligent Customer Service","Knowledge Science, Engineering and Management","","","","10.1007/978-3-030-55130-8_16","Jingxiang HuJunjie PengWenqiang ZhangLizhe QiMiao HuHuanxiang Zhang","2020","http://link.springer.com/chapter/10.1007/978-3-030-55130-8_16","Chapter"
"Dynamic Multi-hop Reasoning","Web and Big Data","","","","10.1007/978-3-030-60259-8_39","Liang XuJunjie YaoYingjie Zhang","2020","http://link.springer.com/chapter/10.1007/978-3-030-60259-8_39","Chapter"
"Spatio-Temporal Self-Attention Network for Next POI Recommendation","Web and Big Data","","","","10.1007/978-3-030-60259-8_30","Jiacheng NiPengpeng ZhaoJiajie XuJunhua FangZhixu LiXuefeng XianZhiming CuiVictor S. Sheng","2020","http://link.springer.com/chapter/10.1007/978-3-030-60259-8_30","Chapter"
"DAKE: Document-Level Attention for Keyphrase Extraction","Advances in Information Retrieval","","","","10.1007/978-3-030-45442-5_49","Tokala Yaswanth Sri Sai SantoshDebarshi Kumar SanyalPlaban Kumar BhowmickPartha Pratim Das","2020","http://link.springer.com/chapter/10.1007/978-3-030-45442-5_49","Chapter"
"Distribution-dependent feature selection for deep neural networks","Applied Intelligence","","52","4","10.1007/s10489-021-02663-1","Xuebin ZhaoWeifu LiHong ChenYingjie WangYanhong ChenVijay John","2022","http://link.springer.com/article/10.1007/s10489-021-02663-1","Article"
"Event Relation Reasoning Based on Event Knowledge Graph","Knowledge Science, Engineering and Management","","","","10.1007/978-3-030-82136-4_40","Tingting TangWei LiuWeimin LiJinliang WuHaiyang Ren","2021","http://link.springer.com/chapter/10.1007/978-3-030-82136-4_40","Chapter"
"Inferring in Circles: Active Inference in Continuous State Space Using Hierarchical Gaussian Filtering of Sufficient Statistics","Machine Learning and Principles and Practice of Knowledge Discovery in Databases","","","","10.1007/978-3-030-93736-2_57","Peter Thestrup WaadeNace MikusChristoph Mathys","2021","http://link.springer.com/chapter/10.1007/978-3-030-93736-2_57","Chapter"
"Student Dropout Prediction","Artificial Intelligence in Education","","","","10.1007/978-3-030-52237-7_11","Francesca Del BonifroMaurizio GabbrielliGiuseppe LisantiStefano Pio Zingaro","2020","http://link.springer.com/chapter/10.1007/978-3-030-52237-7_11","Chapter"
"A Study on Argument-Based Analysis of Legal Model","Innovations in Bio-Inspired Computing and Applications","","","","10.1007/978-3-030-73603-3_42","Riya SilDipanjan SahaAbhishek Roy","2021","http://link.springer.com/chapter/10.1007/978-3-030-73603-3_42","Chapter"
"Revisiting Fast and Slow Thinking in Case-Based Reasoning","Case-Based Reasoning Research and Development","","","","10.1007/978-3-030-86957-1_8","Srashti KauravDevi GanesanDeepak PSutanu Chakraborti","2021","http://link.springer.com/chapter/10.1007/978-3-030-86957-1_8","Chapter"
"HACK: A Hierarchical Model for Fake News Detection","Web Information Systems Engineering – WISE 2021","","","","10.1007/978-3-030-90888-1_43","Yanqi LiKe JiKun MaZhenxiang ChenJun WuYidong LiGuandong Xu","2021","http://link.springer.com/chapter/10.1007/978-3-030-90888-1_43","Chapter"
