sep=,
"Anomaly Android Malware Detection: A Comparative Analysis of Six Classifiers","Information and Communication Technology and Applications","","","","10.1007/978-3-030-69143-1_12","Benjamin A. GyunkaOluwakemi C. AbikoyeAdekeye S. Adekunle","2021","http://link.springer.com/chapter/10.1007/978-3-030-69143-1_12","Chapter"
"Exploring Counterfactual Explanations for Classification and Regression Trees","Machine Learning and Principles and Practice of Knowledge Discovery in Databases","","","","10.1007/978-3-030-93736-2_37","Suryabhan Singh HadaMiguel Á. Carreira-Perpiñán","2021","http://link.springer.com/chapter/10.1007/978-3-030-93736-2_37","Chapter"
"Collaborative Learning Using LSTM-RNN for Personalized Recommendation","Services Computing – SCC 2020","","","","10.1007/978-3-030-59592-0_3","Benjamin A. KwapongRichard AnarfiKenneth K. Fletcher","2020","http://link.springer.com/chapter/10.1007/978-3-030-59592-0_3","Chapter"
"An Optimal Packet Assignment Algorithm for Multi-level Network Intrusion Detection Systems","Industrial Networks and Intelligent Systems","","","","10.1007/978-3-030-63083-6_23","Dao Thi-NgaChi Hieu TaVan Son VuDuc Van Le","2020","http://link.springer.com/chapter/10.1007/978-3-030-63083-6_23","Chapter"
"Extracting Distinctive Shapelets with Random Selection for Early Classification","Knowledge Science, Engineering and Management","","","","10.1007/978-3-030-55130-8_41","Guiling LiWenhe Yan","2020","http://link.springer.com/chapter/10.1007/978-3-030-55130-8_41","Chapter"
"An Empirical Analysis of the Maintainability Evolution of Open Source Systems","Open Source Systems","","","","10.1007/978-3-030-47240-5_8","Gerta KapllaniIlya KhomyakovRuzilya MirgalimovaAlberto Sillitti","2020","http://link.springer.com/chapter/10.1007/978-3-030-47240-5_8","Chapter"
"Sequence Embedding for Zero or Low Resource Knowledge Graph Completion","Database Systems for Advanced Applications","","","","10.1007/978-3-030-73194-6_20","Zhijuan Du","2021","http://link.springer.com/chapter/10.1007/978-3-030-73194-6_20","Chapter"
"Continuous Surrogate-Based Optimization Algorithms Are Well-Suited for Expensive Discrete Problems","Artificial Intelligence and Machine Learning","","","","10.1007/978-3-030-76640-5_4","Rickard KarlssonLaurens BliekSicco VerwerMathijs de Weerdt","2021","http://link.springer.com/chapter/10.1007/978-3-030-76640-5_4","Chapter"
"Effective Cross-Region Courier-Displacement for Instant Delivery via Reinforcement Learning","Wireless Algorithms, Systems, and Applications","","","","10.1007/978-3-030-85928-2_23","Shijie HuBaoshen GuoShuai WangXiaolei Zhou","2021","http://link.springer.com/chapter/10.1007/978-3-030-85928-2_23","Chapter"
"Zero Trust in the Context of the Utility Industry","Proceedings of the Future Technologies Conference (FTC) 2020, Volume 3","","","","10.1007/978-3-030-63092-8_65","Nikhil KumarNoah LaRoy","2021","http://link.springer.com/chapter/10.1007/978-3-030-63092-8_65","Chapter"
"Ethics and Regulation of Artificial Intelligence","Artificial Intelligence for Knowledge Management","","","","10.1007/978-3-030-80847-1_1","Anthony Wong","2021","http://link.springer.com/chapter/10.1007/978-3-030-80847-1_1","Chapter"
"Time Series Encodings with Temporal Convolutional Networks","Bioinspired Optimization Methods and Their Applications","","","","10.1007/978-3-030-63710-1_13","Markus ThillWolfgang KonenThomas Bäck","2020","http://link.springer.com/chapter/10.1007/978-3-030-63710-1_13","Chapter"
"From Models of Cognition to Robot Control and Back Using Spiking Neural Networks","Biomimetic and Biohybrid Systems","","","","10.1007/978-3-030-64313-3_18","Stefan IacobJohan KwisthoutSerge Thill","2020","http://link.springer.com/chapter/10.1007/978-3-030-64313-3_18","Chapter"
"EDKT: An Extensible Deep Knowledge Tracing Model for Multiple Learning Factors","Database Systems for Advanced Applications","","","","10.1007/978-3-030-73194-6_23","Liangliang HeXiao LiJintao TangTing Wang","2021","http://link.springer.com/chapter/10.1007/978-3-030-73194-6_23","Chapter"
"New Measures for Offline Evaluation of Learning Path Recommenders","Addressing Global Challenges and Quality Education","","","","10.1007/978-3-030-57717-9_19","Zhao ZhangArmelle BrunAnne Boyer","2020","http://link.springer.com/chapter/10.1007/978-3-030-57717-9_19","Chapter"
"ML Training on a Tiny Microcontroller for a Self-adaptive Neural Network-Based DC Motor Speed Controller","IoT Streams for Data-Driven Predictive Maintenance and IoT, Edge, and Mobile for Embedded Machine Learning","","","","10.1007/978-3-030-66770-2_20","Frederik FunkThorsten BuckschDaniel Mueller-Gritschneder","2020","http://link.springer.com/chapter/10.1007/978-3-030-66770-2_20","Chapter"
"Improving Affect Detection in Game-Based Learning with Multimodal Data Fusion","Artificial Intelligence in Education","","","","10.1007/978-3-030-52237-7_19","Nathan HendersonJonathan RoweLuc PaquetteRyan S. BakerJames Lester","2020","http://link.springer.com/chapter/10.1007/978-3-030-52237-7_19","Chapter"
"Methodology for Design and Implementation an Efficient HPC Cluster","High Performance Computing","","","","10.1007/978-3-030-68035-0_6","L. A. TorresCarlos J. Barrios","2021","http://link.springer.com/chapter/10.1007/978-3-030-68035-0_6","Chapter"
"Gait Abnormality Detection in People with Cerebral Palsy Using an Uncertainty-Based State-Space Model","Computational Science – ICCS 2020","","","","10.1007/978-3-030-50423-6_40","Saikat ChakrabortyNoble ThomasAnup Nandy","2020","http://link.springer.com/chapter/10.1007/978-3-030-50423-6_40","Chapter"
"Synthesizing Quality Open Data Assets from Private Health Research Studies","Business Information Systems Workshops","","","","10.1007/978-3-030-61146-0_26","Andrew YaleSaloni DashKaran BhanotIsabelle GuyonJohn S. EricksonKristin P. Bennett","2020","http://link.springer.com/chapter/10.1007/978-3-030-61146-0_26","Chapter"
"IterG: An Iteratively Learning Graph Convolutional Network with Ontology Semantics","Web and Big Data","","","","10.1007/978-3-030-60259-8_18","Xingya LiangFuxiang ZhangXin LiuYajun Yang","2020","http://link.springer.com/chapter/10.1007/978-3-030-60259-8_18","Chapter"
"Systematic Review of the Importance of Human Factors in Incorporating Healthcare Automation","Digital Human Modeling and Applications in Health, Safety, Ergonomics and Risk Management. AI, Product and Service","","","","10.1007/978-3-030-77820-0_8","Jessica KurniawanVincent G. Duffy","2021","http://link.springer.com/chapter/10.1007/978-3-030-77820-0_8","Chapter"
"A Graph Attentive Network Model for P2P Lending Fraud Detection","Knowledge Science, Engineering and Management","","","","10.1007/978-3-030-55130-8_28","Qiyi WangHongyan LiuJun HeXiaoyong Du","2020","http://link.springer.com/chapter/10.1007/978-3-030-55130-8_28","Chapter"
"Robust Sequence Embedding for Recommendation","Knowledge Science, Engineering and Management","","","","10.1007/978-3-030-55393-7_11","Rongzhi ZhangShuzi NiuYucheng Li","2020","http://link.springer.com/chapter/10.1007/978-3-030-55393-7_11","Chapter"
"An Assurance Case Pattern for the Interpretability of Machine Learning in Safety-Critical Systems","Computer Safety, Reliability, and Security. SAFECOMP 2020 Workshops","","","","10.1007/978-3-030-55583-2_30","Francis Rhys WardIbrahim Habli","2020","http://link.springer.com/chapter/10.1007/978-3-030-55583-2_30","Chapter"
"Deep Reinforcement Learning for Solving Train Unit Shunting Problem with Interval Timing","Dependable Computing - EDCC 2020 Workshops","","","","10.1007/978-3-030-58462-7_9","Wan-Jui LeeHelia JamshidiDiederik M. Roijers","2020","http://link.springer.com/chapter/10.1007/978-3-030-58462-7_9","Chapter"
"Joint Geographical and Temporal Modeling Based on Matrix Factorization for Point-of-Interest Recommendation","Advances in Information Retrieval","","","","10.1007/978-3-030-45439-5_14","Hossein A. RahmaniMohammad AliannejadiMitra BaratchiFabio Crestani","2020","http://link.springer.com/chapter/10.1007/978-3-030-45439-5_14","Chapter"
"A private Ethereum blockchain implementation for secure data handling in Internet of Medical Things","Journal of Reliable Intelligent Environments","","","","10.1007/s40860-021-00153-2","Dheeraj MohanLakshmi AlwinP. NeerajaK. Deepak LawrenceVinod Pathari","2021","http://link.springer.com/article/10.1007/s40860-021-00153-2","Article"
"Local Intrinsic Dimensionality III: Density and Similarity","Similarity Search and Applications","","","","10.1007/978-3-030-60936-8_19","Michael E. Houle","2020","http://link.springer.com/chapter/10.1007/978-3-030-60936-8_19","Chapter"
"PMD: An Optimal Transportation-Based User Distance for Recommender Systems","Advances in Information Retrieval","","","","10.1007/978-3-030-45442-5_34","Yitong MengXinyan DaiXiao YanJames ChengWeiwen LiuJun GuoBenben LiaoGuangyong Chen","2020","http://link.springer.com/chapter/10.1007/978-3-030-45442-5_34","Chapter"
"Document Network Projection in Pretrained Word Embedding Space","Advances in Information Retrieval","","","","10.1007/978-3-030-45442-5_19","Antoine GourruAdrien GuilleJulien VelcinJulien Jacques","2020","http://link.springer.com/chapter/10.1007/978-3-030-45442-5_19","Chapter"
"DeFraudNet: An End-to-End Weak Supervision Framework to Detect Fraud in Online Food Delivery","Machine Learning and Knowledge Discovery in Databases. Applied Data Science Track","","","","10.1007/978-3-030-86514-6_6","Jose MathewMeghana NegiRutvik VijjaliJairaj Sathyanarayana","2021","http://link.springer.com/chapter/10.1007/978-3-030-86514-6_6","Chapter"
"A Hybrid Neural Network RBERT-C Based on Pre-trained RoBERTa and CNN for User Intent Classification","Neural Computing for Advanced Applications","","","","10.1007/978-981-15-7670-6_26","Yuanxia LiuHai LiuLeung-Pun WongLap-Kei LeeHaijun ZhangTianyong Hao","2020","http://link.springer.com/chapter/10.1007/978-981-15-7670-6_26","Chapter"
"Interpretable Concept-Based Classification with Shapley Values","Ontologies and Concepts in Mind and Machine","","","","10.1007/978-3-030-57855-8_7","Dmitry I. IgnatovLéonard Kwuida","2020","http://link.springer.com/chapter/10.1007/978-3-030-57855-8_7","Chapter"
"Knowledge Graph Attention Network Enhanced Sequential Recommendation","Web and Big Data","","","","10.1007/978-3-030-60259-8_15","Xingwei ZhuPengpeng ZhaoJiajie XuJunhua FangLei ZhaoXuefeng XianZhiming CuiVictor S. Sheng","2020","http://link.springer.com/chapter/10.1007/978-3-030-60259-8_15","Chapter"
"Preparing Students for the Global Engineering Workforce: A Case Study of International Engineering Field Experience at the University of Mount Union","Proceedings of the Future Technologies Conference (FTC) 2021, Volume 3","","","","10.1007/978-3-030-89912-7_48","Okechukwu UgwejeHans Tritico","2022","http://link.springer.com/chapter/10.1007/978-3-030-89912-7_48","Chapter"
"Comparison of HPC Architectures for Computing All-Pairs Shortest Paths. Intel Xeon Phi KNL vs NVIDIA Pascal","Computer Science – CACIC 2020","","","","10.1007/978-3-030-75836-3_3","Manuel CostanzoEnzo RucciUlises CostiFranco ChichizolaMarcelo Naiouf","2021","http://link.springer.com/chapter/10.1007/978-3-030-75836-3_3","Chapter"
"Semantic Modelling of Citation Contexts for Context-Aware Citation Recommendation","Advances in Information Retrieval","","","","10.1007/978-3-030-45439-5_15","Tarek SaierMichael Färber","2020","http://link.springer.com/chapter/10.1007/978-3-030-45439-5_15","Chapter"
"Phishing Detection on Ethereum via Learning Representation of Transaction Subgraphs","Blockchain and Trustworthy Systems","","","","10.1007/978-981-15-9213-3_14","Zihao YuanQi YuanJiajing Wu","2020","http://link.springer.com/chapter/10.1007/978-981-15-9213-3_14","Chapter"
"Rough Net Approach for Community Detection Analysis in Complex Networks","Rough Sets","","","","10.1007/978-3-030-52705-1_30","Ivett FuentesArian PinaGonzalo NápolesLeticia ArcoKoen Vanhoof","2020","http://link.springer.com/chapter/10.1007/978-3-030-52705-1_30","Chapter"
"Attention-Based Knowledge Tracing with Heterogeneous Information Network Embedding","Knowledge Science, Engineering and Management","","","","10.1007/978-3-030-55130-8_9","Nan ZhangYe DuKe DengLi LiJun ShenGeng Sun","2020","http://link.springer.com/chapter/10.1007/978-3-030-55130-8_9","Chapter"
"DAPT 2020 - Constructing a Benchmark Dataset for Advanced Persistent Threats","Deployable Machine Learning for Security Defense","","","","10.1007/978-3-030-59621-7_8","Sowmya MyneniAnkur ChowdharyAbdulhakim SaburSailik SenguptaGarima AgrawalDijiang HuangMyong Kang","2020","http://link.springer.com/chapter/10.1007/978-3-030-59621-7_8","Chapter"
"Using Domain Ontologies for Text Classification. A Use Case to Classify Computer Science Papers","Knowledge Graphs and Semantic Web","","","","10.1007/978-3-030-65384-2_13","Janneth ChicaizaRuth Reátegui","2020","http://link.springer.com/chapter/10.1007/978-3-030-65384-2_13","Chapter"
"A Digital Twin for Safety and Risk Management: A Prototype for a Hydrogen High-Pressure Vessel","Designing for Digital Transformation. Co-Creating Services with Citizens and Industry","","","","10.1007/978-3-030-64823-7_34","Alireza JaribionSiavash H. KhajaviMikael ÖhmanAdriaan KnapenJan Holmström","2020","http://link.springer.com/chapter/10.1007/978-3-030-64823-7_34","Chapter"
"Towards Guidelines for Assessing Qualities of Machine Learning Systems","Quality of Information and Communications Technology","","","","10.1007/978-3-030-58793-2_2","Julien SiebertLisa JoeckelJens HeidrichKoji NakamichiKyoko OhashiIsao NambaRieko YamamotoMikio Aoyama","2020","http://link.springer.com/chapter/10.1007/978-3-030-58793-2_2","Chapter"
"On the Effectiveness of Neural Text Generation Based Data Augmentation for Recognition of Morphologically Rich Speech","Text, Speech, and Dialogue","","","","10.1007/978-3-030-58323-1_47","Balázs TarjánGyörgy SzaszákTibor FegyóPéter Mihajlik","2020","http://link.springer.com/chapter/10.1007/978-3-030-58323-1_47","Chapter"
"Iterative Reasoning over Knowledge Graph","Database Systems for Advanced Applications","","","","10.1007/978-3-030-73194-6_14","Liang XuJunjie Yao","2021","http://link.springer.com/chapter/10.1007/978-3-030-73194-6_14","Chapter"
"Enhancing Robustness of Graph Convolutional Networks via Dropping Graph Connections","Machine Learning and Knowledge Discovery in Databases","","","","10.1007/978-3-030-67664-3_25","Lingwei ChenXiaoting LiDinghao Wu","2021","http://link.springer.com/chapter/10.1007/978-3-030-67664-3_25","Chapter"
"Cross-Lingual Transfer for Hindi Discourse Relation Identification","Text, Speech, and Dialogue","","","","10.1007/978-3-030-58323-1_26","Anirudh DahiyaManish ShrivastavaDipti Misra Sharma","2020","http://link.springer.com/chapter/10.1007/978-3-030-58323-1_26","Chapter"
"A Self-attention Network Based Node Embedding Model","Machine Learning and Knowledge Discovery in Databases","","","","10.1007/978-3-030-67664-3_22","Dai Quoc NguyenTu Dinh NguyenDinh Phung","2021","http://link.springer.com/chapter/10.1007/978-3-030-67664-3_22","Chapter"
"A Hybrid Model with Pre-trained Entity-Aware Transformer for Relation Extraction","Knowledge Science, Engineering and Management","","","","10.1007/978-3-030-55130-8_13","Jinxin YaoMin ZhangBiyang WangXianda Xu","2020","http://link.springer.com/chapter/10.1007/978-3-030-55130-8_13","Chapter"
"Identifying Loners from Their Project Collaboration Records - A Graph-Based Approach","Knowledge Science, Engineering and Management","","","","10.1007/978-3-030-55130-8_17","Qing ZhouJiang LiYinchun TangLiang Ge","2020","http://link.springer.com/chapter/10.1007/978-3-030-55130-8_17","Chapter"
"Contextualized Embeddings in Named-Entity Recognition: An Empirical Study on Generalization","Advances in Information Retrieval","","","","10.1007/978-3-030-45442-5_48","Bruno TailléVincent GuiguePatrick Gallinari","2020","http://link.springer.com/chapter/10.1007/978-3-030-45442-5_48","Chapter"
"Escaping Saddle Points of Empirical Risk Privately and Scalably via DP-Trust Region Method","Machine Learning and Knowledge Discovery in Databases","","","","10.1007/978-3-030-67664-3_6","Di WangJinhui Xu","2021","http://link.springer.com/chapter/10.1007/978-3-030-67664-3_6","Chapter"
"Adversarial Models for Deterministic Finite Automata","Advances in Artificial Intelligence","","","","10.1007/978-3-030-47358-7_55","Kaixuang ZhangQinglong WangC. Lee Giles","2020","http://link.springer.com/chapter/10.1007/978-3-030-47358-7_55","Chapter"
"Software Anti-patterns Detection Under Uncertainty Using a Possibilistic Evolutionary Approach","Genetic Programming","","","","10.1007/978-3-030-72812-0_12","Sofien BoutaibMaha ElarbiSlim BechikhChih-Cheng HungLamjed Ben Said","2021","http://link.springer.com/chapter/10.1007/978-3-030-72812-0_12","Chapter"
"Missing POI Check-in Identification Using Generative Adversarial Networks","Database Systems for Advanced Applications","","","","10.1007/978-3-030-73194-6_38","Meihui ShiDerong ShenYue KouTiezheng NieGe Yu","2021","http://link.springer.com/chapter/10.1007/978-3-030-73194-6_38","Chapter"
"Neural Maximum Independent Set","Machine Learning and Principles and Practice of Knowledge Discovery in Databases","","","","10.1007/978-3-030-93736-2_18","Thomas PontoizeauFlorian SikoraFlorian YgerTristan Cazenave","2021","http://link.springer.com/chapter/10.1007/978-3-030-93736-2_18","Chapter"
"MALOnt: An Ontology for Malware Threat Intelligence","Deployable Machine Learning for Security Defense","","","","10.1007/978-3-030-59621-7_2","Nidhi RastogiSharmishtha DuttaMohammed J. ZakiAlex GittensCharu Aggarwal","2020","http://link.springer.com/chapter/10.1007/978-3-030-59621-7_2","Chapter"
"Deep Analytics for Management and Cybersecurity of the National Energy Grid","Computational Science – ICCS 2020","","","","10.1007/978-3-030-50426-7_23","Ying Zhao","2020","http://link.springer.com/chapter/10.1007/978-3-030-50426-7_23","Chapter"
"S-NET: A Confusion Based Countermeasure Against Power Attacks for SBOX","Embedded Computer Systems: Architectures, Modeling, and Simulation","","","","10.1007/978-3-030-60939-9_20","Abdullah AljuffriPradeep VenkatachalamCezar ReinbrechtSaid HamdiouiMottaqiallah Taouil","2020","http://link.springer.com/chapter/10.1007/978-3-030-60939-9_20","Chapter"
"Deep Multi Agent Reinforcement Learning for Autonomous Driving","Advances in Artificial Intelligence","","","","10.1007/978-3-030-47358-7_7","Sushrut BhallaSriram Ganapathi SubramanianMark Crowley","2020","http://link.springer.com/chapter/10.1007/978-3-030-47358-7_7","Chapter"
"Evaluating Trace Encoding Methods in Process Mining","From Data to Models and Back","","","","10.1007/978-3-030-70650-0_11","Sylvio Barbon JuniorPaolo CeravoloErnesto DamianiGabriel Marques Tavares","2021","http://link.springer.com/chapter/10.1007/978-3-030-70650-0_11","Chapter"
"Characterizing GPU Overclocking Faults","Computer Security – ESORICS 2021","","","","10.1007/978-3-030-88418-5_6","Eldad ZuberiAvishai Wool","2021","http://link.springer.com/chapter/10.1007/978-3-030-88418-5_6","Chapter"
"On the Impact of Network Data Balancing in Cybersecurity Applications","Computational Science – ICCS 2020","","","","10.1007/978-3-030-50423-6_15","Marek PawlickiMichał ChoraśRafał KozikWitold Hołubowicz","2020","http://link.springer.com/chapter/10.1007/978-3-030-50423-6_15","Chapter"
"Extracting Annotations from Textual Descriptions of Processes","Business Process Management","","","","10.1007/978-3-030-58666-9_11","Luis QuishpiJosep CarmonaLluís Padró","2020","http://link.springer.com/chapter/10.1007/978-3-030-58666-9_11","Chapter"
"CIFEF: Combining Implicit and Explicit Features for Friendship Inference in Location-Based Social Networks","Knowledge Science, Engineering and Management","","","","10.1007/978-3-030-55393-7_16","Cheng HeChao PengNa LiXiang ChenZhengfeng YangZhenhao Hu","2020","http://link.springer.com/chapter/10.1007/978-3-030-55393-7_16","Chapter"
"High-Speed Network Attack Detection Framework Based on Optimized Feature Selection","Security and Privacy in Digital Economy","","","","10.1007/978-981-15-9129-7_5","Zhicheng LuoWeijia DingAnmin FuZhiyi ZhangLinjie Zhang","2020","http://link.springer.com/chapter/10.1007/978-981-15-9129-7_5","Chapter"
"Multilingual Dependency Parsing from Universal Dependencies to Sesame Street","Text, Speech, and Dialogue","","","","10.1007/978-3-030-58323-1_2","Joakim Nivre","2020","http://link.springer.com/chapter/10.1007/978-3-030-58323-1_2","Chapter"
"A Large-Scale, Open-Domain, Mixed-Interface Dialogue-Based ITS for STEM","Artificial Intelligence in Education","","","","10.1007/978-3-030-52240-7_70","Iulian Vlad SerbanVarun GuptaEkaterina KochmarDung D. VuRobert BelferJoelle PineauAaron CourvilleLaurent CharlinYoshua Bengio","2020","http://link.springer.com/chapter/10.1007/978-3-030-52240-7_70","Chapter"
"Exploring the Impact of Simple Explanations and Agency on Batch Deep Reinforcement Learning Induced Pedagogical Policies","Artificial Intelligence in Education","","","","10.1007/978-3-030-52237-7_38","Markel Sanz AusinMehak ManiktalaTiffany BarnesMin Chi","2020","http://link.springer.com/chapter/10.1007/978-3-030-52237-7_38","Chapter"
"Strategies for Deploying Unreliable AI Graders in High-Transparency High-Stakes Exams","Artificial Intelligence in Education","","","","10.1007/978-3-030-52237-7_2","Sushmita AzadBinglin ChenMaxwell FowlerMatthew WestCraig Zilles","2020","http://link.springer.com/chapter/10.1007/978-3-030-52237-7_2","Chapter"
"Deep Generation of Coq Lemma Names Using Elaborated Terms","Automated Reasoning","","","","10.1007/978-3-030-51054-1_6","Pengyu NieKarl PalmskogJunyi Jessy LiMilos Gligoric","2020","http://link.springer.com/chapter/10.1007/978-3-030-51054-1_6","Chapter"
"Enhancing Academic Reading Skills Using a Peer Assessment of Online Collaborative Annotation Approach","Technology in Education. Innovations for Online Teaching and Learning","","","","10.1007/978-981-33-4594-2_24","Wing Shui NgHaoran XieGary Cheng","2020","http://link.springer.com/chapter/10.1007/978-981-33-4594-2_24","Chapter"
"A Survey of Languages for Formalizing Mathematics","Intelligent Computer Mathematics","","","","10.1007/978-3-030-53518-6_9","Cezary KaliszykFlorian Rabe","2020","http://link.springer.com/chapter/10.1007/978-3-030-53518-6_9","Chapter"
"Parameter Optimization and Weights Assessment for Evidential Artificial Immune Recognition System","Knowledge Science, Engineering and Management","","","","10.1007/978-3-030-55393-7_3","Rihab AbdelkhalekZied Elouedi","2020","http://link.springer.com/chapter/10.1007/978-3-030-55393-7_3","Chapter"
"Is Artificial Intelligence Ready for Standardization?","Systems, Software and Services Process Improvement","","","","10.1007/978-3-030-56441-4_19","Thomas Zielke","2020","http://link.springer.com/chapter/10.1007/978-3-030-56441-4_19","Chapter"
"Automated Generation of Executable RPA Scripts from User Interface Logs","Business Process Management: Blockchain and Robotic Process Automation Forum","","","","10.1007/978-3-030-58779-6_8","Simone AgostinelliMarco LupiaAndrea MarrellaMassimo Mecella","2020","http://link.springer.com/chapter/10.1007/978-3-030-58779-6_8","Chapter"
"GOPHER, an HPC Framework for Large Scale Graph Exploration and Inference","High Performance Computing","","","","10.1007/978-3-030-59851-8_13","Marc Josep-FabregóXavier TeruelVictor Gimenez-AbalosDavide CirilloDario Garcia-GasullaSergio Alvarez-NapagaoMarta García-GasullaEduard AyguadéAlfonso Valencia","2020","http://link.springer.com/chapter/10.1007/978-3-030-59851-8_13","Chapter"
"Recognising the Types of Software Assets and Its Impact on Asset Reuse","Systems, Software and Services Process Improvement","","","","10.1007/978-3-030-56441-4_12","Kathleen WolframMichael MartinePaul Sudnik","2020","http://link.springer.com/chapter/10.1007/978-3-030-56441-4_12","Chapter"
"Employing Sentence Context in Czech Answer Selection","Text, Speech, and Dialogue","","","","10.1007/978-3-030-58323-1_12","Marek MedveďRadoslav SabolAleš Horák","2020","http://link.springer.com/chapter/10.1007/978-3-030-58323-1_12","Chapter"
"Open Information Extraction for Knowledge Graph Construction","Database and Expert Systems Applications","","","","10.1007/978-3-030-59028-4_10","Iqra MuhammadAnna KearneyCarrol GambleFrans CoenenPaula Williamson","2020","http://link.springer.com/chapter/10.1007/978-3-030-59028-4_10","Chapter"
"A Bayesian Optimisation Approach for Multidimensional Knapsack Problem","Optimization and Learning","","","","10.1007/978-3-030-85672-4_7","Hanyu GuAlireza EtminaniesfahaniAmir Salehipour","2021","http://link.springer.com/chapter/10.1007/978-3-030-85672-4_7","Chapter"
"PUA Detection Based on Bundle Installer Characteristics","Data and Applications Security and Privacy XXXIV","","","","10.1007/978-3-030-49669-2_15","Amir LukachEhud GudesAsaf Shabtai","2020","http://link.springer.com/chapter/10.1007/978-3-030-49669-2_15","Chapter"
"Mining Anomalies in Subspaces of High-Dimensional Time Series for Financial Transactional Data","Machine Learning and Knowledge Discovery in Databases. Applied Data Science Track","","","","10.1007/978-3-030-86514-6_2","Jingzhu HeChin-Chia Michael YehYanhong WuLiang WangWei Zhang","2021","http://link.springer.com/chapter/10.1007/978-3-030-86514-6_2","Chapter"
"A Resource Consumption Attack Identification Method Based on Data Fusion","Smart Grid and Innovative Frontiers in Telecommunications","","","","10.1007/978-3-030-73562-3_11","Libin JiaoYonghua HuoNingling GeZhongdi GeYang Yang","2021","http://link.springer.com/chapter/10.1007/978-3-030-73562-3_11","Chapter"
"Designing and Testing Assessments and Scaffolds for Mathematics Practices in Science Inquiry","Artificial Intelligence in Education","","","","10.1007/978-3-030-78270-2_84","Joe OlsenJanice Gobert","2021","http://link.springer.com/chapter/10.1007/978-3-030-78270-2_84","Chapter"
